id,title,release_date,overview,genres,poster_path
324552,John Wick: Chapter 2,2017-02-08,"John Wick is forced out of retirement by a former associate looking to seize control of a shadowy international assassins’ guild. Bound by a blood oath to aid him, Wick travels to Rome and does battle against some of the world’s most dangerous killers.","Action, Thriller, Crime",/hXWBc0ioZP3cN4zCu6SN3YHXZVO.jpg
615656,Meg 2: The Trench,2023-08-02,An exploratory dive into the deepest depths of the ocean of a daring research team spirals into chaos when a malevolent mining operation threatens their mission and forces them into a high-stakes battle for survival.,"Action, Science Fiction, Horror",/4m1Au3YkjqsxF8iwQy0fPYSxE0h.jpg
397243,The Autopsy of Jane Doe,2016-12-21,"Father and son coroners receive a mysterious unidentified corpse with no apparent cause of death. As they attempt to examine the ""Jane Doe,"" they discover increasingly bizarre clues that hold the key to her terrifying secrets.","Horror, Mystery",/6K0wjP8kPCiPYy9PtXBGuypyt5I.jpg
889737,Joker: Folie à Deux,2024-09-30,"While struggling with his dual identity, Arthur Fleck not only stumbles upon true love, but also finds the music that's always been inside him.","Drama, Crime, Thriller",/zPOOyw6HBb5Qo6uaWJ5UxrBR6Ll.jpg
954,Mission: Impossible,1996-05-22,"When Ethan Hunt, the leader of a crack espionage team whose perilous operation has gone awry with no explanation, discovers that a mole has penetrated the CIA, he's surprised to learn that he's the prime suspect. To clear his name, Hunt now must ferret out the real double agent and, in the process, even the score.","Adventure, Action, Thriller",/l5uxY5m5OInWpcExIpKG6AR3rgL.jpg
1079485,Winnie-the-Pooh: Blood and Honey 2,2024-03-26,"Five months following the murders, Christopher Robin struggles to maintain a regular life while dealing with PTSD. However, deep within the 100-Acre-Wood, a destructive rage grows as Pooh, Piglet, Owl, and Tigger find their home and their lives endangered after their existence is revealed.","Horror, Thriller",/2sADrLwMQof6yYmrJRSa04tFZuS.jpg
974262,Descendants: The Rise of Red,2024-07-11,"After the Queen of Hearts incites a coup on Auradon, her rebellious daughter Red and Cinderella's perfectionist daughter Chloe join forces and travel back in time to try to undo the traumatic event that set Red's mother down her villainous path.","Fantasy, Adventure, Family, Comedy",/8fYluTtB3b3HKO7KQa5tzrvGaps.jpg
870360,The Day the Earth Blew Up: A Looney Tunes Movie,2024-08-01,"Porky and Daffy, the classic animated odd couple, turn into unlikely heroes when their antics at the local bubble gum factory uncover a secret alien mind control plot. Against all odds, the two are determined to save their town (and the world!)...that is if they don't drive each other crazy in the process.","Family, Comedy, Adventure, Animation",/s2lB1kaYCdGSnZX5meQCiOR6HfX.jpg
209112,Batman v Superman: Dawn of Justice,2016-03-23,"Fearing the actions of a god-like Super Hero left unchecked, Gotham City’s own formidable, forceful vigilante takes on Metropolis’s most revered, modern-day savior, while the world wrestles with what sort of hero it really needs. And with Batman and Superman at war with one another, a new threat quickly arises, putting mankind in greater danger than it’s ever known before.","Action, Adventure, Fantasy",/5UsK3grJvtQrtzEgqNlDljJW96w.jpg
245891,John Wick,2014-10-22,Ex-hitman John Wick comes out of retirement to track down the gangsters that took everything from him.,"Action, Thriller",/TxbvYS8wsgYSpYZtQLZXnoVOIQ.jpg
77338,The Intouchables,2011-11-02,A true story of two men who should never have met – a quadriplegic aristocrat who was injured in a paragliding accident and a young man from the projects.,"Drama, Comedy",/1QU7HKgsQbGpzsJbJK4pAVQV9F5.jpg
1154215,Elyas,2024-07-03,"Elyas, a former Special Forces soldier who has become paranoid since a mission in Afghanistan, is recruited to ensure the safety of Amina and her daughter Nour, 13 years old, both of whom came from the Middle East for the holidays. As he takes office, Elyas senses something is up.","Action, Thriller",/5q7CPIjfaBAuItjRgXVWVoafQEs.jpg
497698,Black Widow,2021-07-07,"Natasha Romanoff, also known as Black Widow, confronts the darker parts of her ledger when a dangerous conspiracy with ties to her past arises. Pursued by a force that will stop at nothing to bring her down, Natasha must deal with her history as a spy and the broken relationships left in her wake long before she became an Avenger.","Action, Adventure, Science Fiction",/kwB7d51AIcyzPOBOHLCEZJkmPhQ.jpg
370663,Below Her Mouth,2017-02-10,An unexpected affair quickly escalates into a heart-stopping reality for two women whose passionate connection changes their lives forever.,"Drama, Romance",/tPhBftWySbanfEialbsUzOuccgN.jpg
57800,Ice Age: Continental Drift,2012-06-27,"Manny, Diego, and Sid embark upon another adventure after their continent is set adrift. Using an iceberg as a ship, they encounter sea creatures and battle pirates as they explore a new world.","Animation, Comedy, Adventure, Family",/dfp1BZF7FxbBUyzHvMOI9t8NWDD.jpg
9353,Nacho Libre,2006-06-16,"Nacho Libre is loosely based on the story of Fray Tormenta (""Friar Storm""), aka Rev. Sergio Gutierrez Benitez, a real-life Mexican Catholic priest who had a 23-year career as a masked luchador. He competed in order to support the orphanage he directed.",Comedy,/kh7B91bMl2lZ0mH9WhPfaNUIEQH.jpg
447277,The Little Mermaid,2023-05-18,"The youngest of King Triton’s daughters, and the most defiant, Ariel longs to find out more about the world beyond the sea, and while visiting the surface, falls for the dashing Prince Eric. With mermaids forbidden to interact with humans, Ariel makes a deal with the evil sea witch, Ursula, which gives her a chance to experience life on land, but ultimately places her life – and her father’s crown – in jeopardy.","Adventure, Family, Fantasy, Romance",/cJbKUdbWcIFDuHhs6uvOfacemc4.jpg
1222064,River of Blood,2024-08-29,Four kayakers take the wrong river into a jungle inhabited by a tribe of merciless cannibals.,"Horror, Thriller",/7lkm4eAvHy1uCs48GEwMxgwNdgd.jpg
109418,Grown Ups 2,2013-07-11,"Lenny has relocated his family back to the small town where he and his friends grew up. This time around, the grown ups are the ones learning lessons from their kids on a day notoriously full of surprises—the last day of school.",Comedy,/hT6ijOtjtYrnyDhN7VA2QWyGFAm.jpg
1357459,Tatsulok,2024-10-11,"Story about a happily married couple visited by an old friend, who ends up stirring the pot by becoming sexually involved with both the husband and the wife.","Drama, Romance",/zcmPxGIBxxsGVyYuzNWPCWjlQ8X.jpg
1109255,Parthenope,2024-10-19,"Parthenope, born in the sea near Naples in 1950, is beautiful, enigmatic, and intelligent. She is shamelessly courted by many. However, beauty comes at a cost.","Romance, Drama",/uhMIPArCsAzMKRMtLj2VDqAd6ZO.jpg
438148,Minions: The Rise of Gru,2022-06-29,"A fanboy of a supervillain supergroup known as the Vicious 6, Gru hatches a plan to become evil enough to join them, with the backup of his followers, the Minions.","Animation, Comedy, Family, Adventure",/wKiOkZTN9lUUUNZLmtnwubZYONg.jpg
3933,Corpse Bride,2005-09-12,"In a 19th-century European village, a young man about to be married is whisked away to the underworld and wed to a mysterious corpse bride, while his real bride waits bereft in the land of the living.","Romance, Fantasy, Animation",/isb2Qow76GpqYmsSyfdMfsYAjts.jpg
1326106,Kaiju No. 8: Mission Recon,2025-03-28,"In a Kaiju-filled Japan, Kafka Hibino works in monster disposal. After reuniting with his childhood friend Mina Ashiro, a rising star in the anti-Kaiju Defense Force, he decides to pursue his abandoned dream of joining the Force, when he suddenly transforms into the powerful ""Kaiju No. 8."" An action-packed recap of the first season of Kaiju No. 8 and a new original episode, Hoshina's Day Off.","Animation, Action, Science Fiction",/2mU8qUbYKlHBdmDDbCmKLuqXd1m.jpg
87101,Terminator Genisys,2015-06-23,"The year is 2029. John Connor, leader of the resistance continues the war against the machines. At the Los Angeles offensive, John's fears of the unknown future begin to emerge when TECOM spies reveal a new plot by SkyNet that will attack him from both fronts; past and future, and will ultimately change warfare forever.","Science Fiction, Action, Thriller, Adventure",/oZRVDpNtmHk8M1VYy1aeOWUXgbC.jpg
635302,Demon Slayer -Kimetsu no Yaiba- The Movie: Mugen Train,2020-10-16,"Tanjiro Kamado, joined with Inosuke Hashibira, a boy raised by boars who wears a boar's head, and Zenitsu Agatsuma, a scared boy who reveals his true power when he sleeps, boards the Infinity Train on a new mission with the Fire Hashira, Kyojuro Rengoku, to defeat a demon who has been tormenting the people and killing the demon slayers who oppose it!","Animation, Action, Fantasy, Thriller",/h8Rb9gBr48ODIwYUttZNYeMWeUU.jpg
1371727,Sing: Thriller,2024-10-15,"Buster Moon dreams up a star-studded spectacle set to Michael Jackson's ""Thriller"" in this animated short featuring characters from the hit ""Sing"" films.","Animation, Family, Comedy, Music",/i77OInTKcrnRlAozFOaB6D5mk15.jpg
353486,Jumanji: Welcome to the Jungle,2017-12-09,"Four teenagers in detention discover an old video game console with a game they’ve never heard of. When they decide to play, they are immediately sucked into the jungle world of Jumanji in the bodies of their avatars. They’ll have to complete the adventure of their lives filled with fun, thrills and danger or be stuck in the game forever!","Adventure, Comedy, Fantasy, Action, Family",/pSgXKPU5h6U89ipF7HBYajvYt7j.jpg
12153,White Chicks,2004-06-23,"Two FBI agent brothers, Marcus and Kevin Copeland, accidentally foil a drug bust. To avoid being fired they accept a mission escorting a pair of socialites to the Hamptons--but when the girls are disfigured in a car accident, they refuse to go. Left without options, Marcus and Kevin decide to pose as the sisters, transforming themselves from black men into rich white women.","Comedy, Crime",/aHTUpo45qy9QYIOnVITGGqLoVcA.jpg
9552,The Exorcist,1973-12-26,"When a charming 12-year-old girl takes on the characteristics and voices of others, doctors say there is nothing they can do. As people begin to die, the girl's mother realizes her daughter has been possessed by the Devil. Her daughter's only possible hope lies with two priests and the ancient rite of demonic exorcism.",Horror,/5x0CeVHJI8tcDx8tUUwYHQSNILq.jpg
527774,Raya and the Last Dragon,2021-03-03,"Long ago, in the fantasy world of Kumandra, humans and dragons lived together in harmony. But when an evil force threatened the land, the dragons sacrificed themselves to save humanity. Now, 500 years later, that same evil has returned and it’s up to a lone warrior, Raya, to track down the legendary last dragon to restore the fractured land and its divided people.","Animation, Family, Fantasy, Action, Adventure",/5nVhgCzxKbK47OLIKxCR1syulOn.jpg
818647,Through My Window,2022-02-04,"Raquel's longtime crush on her next-door neighbor turns into something more when he starts developing feelings for her, despite his family's objections.","Romance, Drama, Comedy",/jmkpZvMVIRrMFevxzOubSBfG0s0.jpg
111,Scarface,1983-12-09,"After getting a green card in exchange for assassinating a Cuban government official, Tony Montana stakes a claim on the drug trade in Miami. Viciously murdering anyone who stands in his way, Tony eventually becomes the biggest drug lord in the state, controlling nearly all the cocaine that comes through Miami. But increased pressure from the police, wars with Colombian drug cartels and his own drug-fueled paranoia serve to fuel the flames of his eventual downfall.","Action, Crime, Drama",/iQ5ztdjvteGeboxtmRdXEChJOHh.jpg
707610,Bosomy Mom,2020-05-06,"Da-hee gets married to Min-soo who is older than her. Thanks to him, he also gets a son who is not too old, Jae-hyuk, who she tries to get acquainted with, albeit awkwardly. After staying with Na-yeon, she suddenly has to meet Jae-hyuk, and Na-yeon has a date with Jae-hyuk. Min-soo is surprised to find three people coming back home from a date. It made him angry to see his son with two women. Right away, Min-soo seeks Da-hee and asks about Na-yeon. Na-yeon met Min-soo secretly. However, Da-hee who is aware of Min-soo and Da-hee's relationship, shares this fact to Jae-hyun.","Drama, Romance",/zarhMAQRWKjjsNBR1rviIXZ5xtt.jpg
1461519,Untitled A Minecraft Movie Sequel,,The sequel to A Minecraft Movie. Plot TBA.,"Family, Comedy, Adventure, Fantasy",
381284,Hidden Figures,2016-12-10,"The untold story of Katherine G. Johnson, Dorothy Vaughan and Mary Jackson – brilliant African-American women working at NASA and serving as the brains behind one of the greatest operations in history – the launch of astronaut John Glenn into orbit. The visionary trio crossed all gender and race lines to inspire generations to dream big.","Drama, History",/9lfz2W2uGjyow3am00rsPJ8iOyq.jpg
68718,Django Unchained,2012-12-25,"With the help of a German bounty hunter, a freed slave sets out to rescue his wife from a brutal Mississippi plantation owner.","Drama, Western",/bV0rWoiRo7pHUTQkh6Oio6irlXO.jpg
1234821,Jurassic World Rebirth,2025-07-01,"Five years after the events of Jurassic World Dominion, covert operations expert Zora Bennett is contracted to lead a skilled team on a top-secret mission to secure genetic material from the world's three most massive dinosaurs. When Zora's operation intersects with a civilian family whose boating expedition was capsized, they all find themselves stranded on an island where they come face-to-face with a sinister, shocking discovery that's been hidden from the world for decades.","Science Fiction, Adventure, Thriller",/8BZ6oGDE336qFshFC44WxZtosBX.jpg
2251,Unfaithful,2002-05-10,"Connie is a wife and mother whose 11-year marriage to Edward has lost its sexual spark. When Connie literally runs into handsome book collector Paul, he sweeps her into an all-consuming affair. But Edward soon becomes suspicious and decides to confront the other man.","Thriller, Drama, Romance",/bjiHEhuiwhIygzjczbTPAA07cGc.jpg
285,Pirates of the Caribbean: At World's End,2007-05-19,"Will Turner and Elizabeth Swann join forces with the revived Captain Barbossa to free Jack Sparrow from Davy Jones' locker. The group must navigate dangerous waters, confront many foes and, ultimately, choose sides in a battle wherein piracy itself hangs in the balance.","Adventure, Fantasy, Action",/jGWpG4YhpQwVmjyHEGkxEkeRf0S.jpg
439079,The Nun,2018-09-05,A priest with a haunted past and a novice on the threshold of her final vows are sent by the Vatican to investigate the death of a young nun in Romania and confront a malevolent force in the form of a demonic nun.,Horror,/sFC1ElvoKGdHJIWRpNB3xWJ9lJA.jpg
263115,Logan,2017-02-28,"In the near future, a weary Logan cares for an ailing Professor X in a hideout on the Mexican border. But Logan's attempts to hide from the world and his legacy are upended when a young mutant arrives, pursued by dark forces.","Action, Drama, Science Fiction",/fnbjcRDYn6YviCcePDnGdyAkYsB.jpg
9453,Caligula,1979-08-14,"After the death of the paranoid emperor Tiberius, Caligula, his heir, seizes power and plunges the empire into a bloody spiral of madness and depravity.","Drama, History",/vNXAY6r9Pb6WkMCGmNeW2PlznLQ.jpg
985939,Fall,2022-08-11,"For best friends Becky and Hunter, life is all about conquering fears and pushing limits. But after they climb 2,000 feet to the top of a remote, abandoned radio tower, they find themselves stranded with no way down. Now Becky and Hunter’s expert climbing skills will be put to the ultimate test as they desperately fight to survive the elements, a lack of supplies, and vertigo-inducing heights",Thriller,/v28T5F1IygM8vXWZIycfNEm3xcL.jpg
14160,Up,2009-05-28,"Carl Fredricksen spent his entire life dreaming of exploring the globe and experiencing life to its fullest. But at age 78, life seems to have passed him by, until a twist of fate (and a persistent 8-year old Wilderness Explorer named Russell) gives him a new lease on life.","Animation, Comedy, Family, Adventure",/mFvoEwSfLqbcWwFsDjQebn9bzFe.jpg
1164355,Lembayung,2024-09-19,"Arum and Pica, who wanted to complete their internship at Lembayung hospital, had to face mysterious terror from a woman satan who was suspected of hanged herself in the bathroom. The situation became even more tense after they asked others for help to the point where they threatened their own lives and those closest to them.","Horror, Thriller",/5x9LrW0yvtt6S3XovIQHgXfYvLL.jpg
150689,Cinderella,2015-03-06,"When her father unexpectedly passes away, young Ella finds herself at the mercy of her cruel stepmother and her daughters. Never one to give up hope, Ella's fortunes begin to change after meeting a dashing stranger in the woods.","Romance, Fantasy, Family, Drama",/j91LJmcWo16CArFOoapsz84bwxb.jpg
420817,Aladdin,2019-05-22,A kindhearted street urchin named Aladdin embarks on a magical adventure after finding a lamp that releases a wisecracking genie while a power-hungry Grand Vizier vies for the same lamp that has the power to make their deepest wishes come true.,"Adventure, Fantasy, Romance, Family",/ykUEbfpkf8d0w49pHh0AD2KrT52.jpg
50620,The Twilight Saga: Breaking Dawn - Part 2,2012-11-13,"After the birth of Renesmee, the Cullens gather other vampire clans in order to protect the child from a false allegation that puts the family in front of the Volturi.","Adventure, Fantasy, Drama, Romance",/7IGdPaKujv0BjI0Zd0m0a4CzEjJ.jpg
350,The Devil Wears Prada,2006-06-29,"Andy moves to New York to work in the fashion industry. Her boss is extremely demanding, cruel and won't let her succeed if she doesn't fit into the high class elegant look of their magazine.","Drama, Comedy",/OfFMqWQDZ4SlLtHiofyRoLjXdX.jpg
75780,Jack Reacher,2012-12-20,"One morning in an ordinary town, five people are shot dead in a seemingly random attack. All evidence points to a single suspect: an ex-military sniper who is quickly brought into custody. The interrogation yields one written note: 'Get Jack Reacher!'. Reacher, an enigmatic ex-Army investigator, believes the authorities have the right man but agrees to help the sniper's defense attorney. However, the more Reacher delves into the case, the less clear-cut it appears. So begins an extraordinary chase for the truth, pitting Jack Reacher against an unexpected enemy, with a skill for violence and a secret to keep.","Crime, Drama, Thriller, Action",/gLv55839pz4lhyKGRaJKbty41yq.jpg
10192,Shrek Forever After,2010-05-20,"A bored and domesticated Shrek pacts with deal-maker Rumpelstiltskin to get back to feeling like a real ogre again, but when he's duped and sent to a twisted version of Far Far Away—where Rumpelstiltskin is king, ogres are hunted, and he and Fiona have never met—he sets out to restore his world and reclaim his true love.","Comedy, Adventure, Fantasy, Animation, Family",/6HrfPZtKcGmX2tUWW3cnciZTaSD.jpg
420634,Terrifier,2018-01-25,A maniacal clown named Art terrorizes three young women on Halloween night and everyone else who stands in his way.,"Horror, Thriller",/fjXqhGmaeQpB73WerhrYU6HlyV5.jpg
1161680,A Whole Life,2023-11-09,"When Andreas arrives in the remote valley in the Austrian Alps, he is only about four years old - nobody knows for sure. He grows up to become a skilled farmhand and, as a young man, joins a work crew that builds one of the first mountain railroads, bringing light and noise to the valley along with electricity. He also finds the love of his life in Marie, but their happiness is short-lived. Only many years later, when Andreas embarks on his final journey, she is with him once again. And in amazement Andreas looks back at all the years that lie behind him.","Drama, History",/podcOble2lPYMQoBIwBPYaHtGhy.jpg
284052,Doctor Strange,2016-10-25,"After his career is destroyed, a brilliant but arrogant surgeon gets a new lease on life when a sorcerer takes him under her wing and trains him to defend the world against evil.","Action, Adventure, Fantasy",/uGBVj3bEbCoZbDjjl9wTxcygko1.jpg
695721,The Hunger Games: The Ballad of Songbirds & Snakes,2023-11-15,"64 years before he becomes the tyrannical president of Panem, Coriolanus Snow sees a chance for a change in fortunes when he mentors Lucy Gray Baird, the female tribute from District 12.","Drama, Science Fiction, Adventure",/lrkOYL5GBTFW9cgs9RlojxAcZZF.jpg
73861,A Serbian Film,2010-06-16,"Retired porn star Milos leads a normal family life trying to make ends meet. Presented with the opportunity of a lifetime to financially support his family for the rest of their lives, Milos must participate in one last mysterious film. From then on, Milos is drawn into a maelstrom of unbelievable cruelty and mayhem.","Crime, Horror, Thriller",/cToUzXZ9AcUylfIt8vnXhiy6Y9m.jpg
1949,Zodiac,2007-03-02,"The Zodiac murders cause the lives of Paul Avery, David Toschi and Robert Graysmith to intersect.","Crime, Drama, Mystery, Thriller",/6YmeO4pB7XTh8P8F960O1uA14JO.jpg
120467,The Grand Budapest Hotel,2014-02-26,"The Grand Budapest Hotel tells of a legendary concierge at a famous European hotel between the wars and his friendship with a young employee who becomes his trusted protégé. The story involves the theft and recovery of a priceless Renaissance painting, the battle for an enormous family fortune and the slow and then sudden upheavals that transformed Europe during the first half of the 20th century.","Comedy, Drama",/eWdyYQreja6JGCzqHWXpWHDrrPo.jpg
46195,Rio,2011-04-03,"Captured by smugglers when he was just a hatchling, a macaw named Blu never learned to fly and lives a happily domesticated life in Minnesota with his human friend, Linda. Blu is thought to be the last of his kind, but when word comes that Jewel, a lone female, lives in Rio de Janeiro, Blu and Linda go to meet her. Animal smugglers kidnap Blu and Jewel, but the pair soon escape and begin a perilous adventure back to freedom -- and Linda.","Animation, Adventure, Comedy, Family",/4nJxhUknKV8Gqdhov8pU1YWDYfb.jpg
194,Amélie,2001-04-25,"At a tiny Parisian café, the adorable yet painfully shy Amélie accidentally discovers a gift for helping others. Soon Amelie is spending her days as a matchmaker, guardian angel, and all-around do-gooder. But when she bumps into a handsome stranger, will she find the courage to become the star of her very own love story?","Comedy, Romance",/oTKduWL2tpIKEmkAqF4mFEAWAsv.jpg
44896,Rango,2011-03-02,"When Rango, a lost family pet, accidentally winds up in the gritty, gun-slinging town of Dirt, the less-than-courageous lizard suddenly finds he stands out. Welcomed as the last hope the town has been waiting for, new Sheriff Rango is forced to play his new role to the hilt.","Animation, Comedy, Family, Western, Adventure",/A5MP1guV8pbruieG0tnpPIbaJtt.jpg
10830,Matilda,1996-08-02,"Matilda Wormwood is an exquisite and intelligent little girl. Unfortunately, her parents, Harry and Zinnia misunderstand her because they think she is so different. As time passes, she finally starts school and has a kind teacher, loyal friends, and a sadistic headmistress. As she gets fed up with the constant cruelty, she begins to realize that she has a gift of telekinetic powers. After some days of practice, she suddenly turns the tables to stand up to Harry and Zinnia and outwit the headmistress.","Comedy, Family, Fantasy",/wYoDpWInsBEVSmWStnRH06ddoyk.jpg
29993,Samson and Delilah,1949-12-21,"When strongman Samson rejects the love of the beautiful Philistine woman Delilah, she seeks vengeance that brings horrible consequences they both regret.","Adventure, Romance, Drama",/iNb2KMv056vpCJycqFp5Xbpw61Z.jpg
1182387,Armor,2024-10-30,"Armored truck security guard James Brody is working with his son Casey transporting millions of dollars between banks when a team of thieves led by Rook orchestrate a takeover of their truck to seize the riches. Following a violent car chase, Rook soon has the armored truck surrounded and James and Casey find themselves cornered onto a decrepit bridge.","Action, Crime, Thriller, Drama",/pnXLFioDeftqjlCVlRmXvIdMsdP.jpg
207703,Kingsman: The Secret Service,2015-01-24,The story of a super-secret spy organization that recruits an unrefined but promising street kid into the agency's ultra-competitive training program just as a global threat emerges from a twisted tech genius.,"Crime, Comedy, Action, Adventure",/r6q9wZK5a2K51KFj4LWVID6Ja1r.jpg
348350,Solo: A Star Wars Story,2018-05-15,"Through a series of daring escapades deep within a dark and dangerous criminal underworld, Han Solo meets his mighty future copilot Chewbacca and encounters the notorious gambler Lando Calrissian.","Science Fiction, Adventure, Action",/4oD6VEccFkorEBTEDXtpLAaz0Rl.jpg
316029,The Greatest Showman,2017-12-20,"The story of American showman P.T. Barnum, founder of the circus that became the famous traveling Ringling Bros. and Barnum & Bailey Circus.",Drama,/b9CeobiihCx1uG1tpw8hXmpi7nm.jpg
9737,Bad Boys,1995-04-07,"Marcus Burnett is a henpecked family man. Mike Lowrey is a footloose and fancy free ladies' man. Both Miami policemen, they have 72 hours to reclaim a consignment of drugs stolen from under their station's nose. To complicate matters, in order to get the assistance of the sole witness to a murder, they have to pretend to be each other.","Action, Comedy, Crime, Thriller",/qKiLKvJaT6rRmd3IBsoVV58luXH.jpg
453395,Doctor Strange in the Multiverse of Madness,2022-05-04,"Doctor Strange, with the help of mystical allies both old and new, traverses the mind-bending and dangerous alternate realities of the Multiverse to confront a mysterious new adversary.","Fantasy, Action, Adventure",/ddJcSKbcp4rKZTmuyWaMhuwcfMz.jpg
