id,title,release_date,overview,genres,poster_path
483456,Peacemaker Kurogane: Belief,2018-06-02,"Although traumatized by witnessing the murder of his parents by one of the Choushuu, Ichimura Tetsunosuke's thirst for revenge leads him to desire strength. At the age of 15, Tetsunosuke approached the Shinsengumi, wanting to become one of its members. However, Tetsunosuke lacked the skill, mind, and will to emotionlessly cut down whoever threatened peace and the Shinsengumi. Even with the support of his brother Tatsunosuke and his newfound friends of the Shinsengumi, little did Tetsunosuke know the blood and pain he would have to face being part of this historical group.","Animation, History, Action, Drama, Fantasy, Romance",/wbyIM5s7ZgwOmXycjBttBhhXtTq.jpg
1005331,Carry-On,2024-12-05,An airport security officer races to outsmart a mysterious traveler forcing him to let a dangerous item slip onto a Christmas Eve flight.,"Thriller, Action",/sjMN7DRi4sGiledsmllEw5HJjPy.jpg
507086,Jurassic World Dominion,2022-06-01,"Four years after Isla Nublar was destroyed, dinosaurs now live—and hunt—alongside humans all over the world. This fragile balance will reshape the future and determine, once and for all, whether human beings are to remain the apex predators on a planet they now share with history's most fearsome creatures.","Adventure, Action, Science Fiction",/jbAvCACjLf1ZG0unB2tdmx5HAf1.jpg
315162,Puss in Boots: The Last Wish,2022-12-07,"Puss in Boots discovers that his passion for adventure has taken its toll: He has burned through eight of his nine lives, leaving him with only one life left. Puss sets out on an epic journey to find the mythical Last Wish and restore his nine lives.","Animation, Adventure, Fantasy, Comedy, Family",/kuf6dutpsT0vSVehic3EZIqkOBt.jpg
675353,Sonic the Hedgehog 2,2022-03-30,"After settling in Green Hills, Sonic is eager to prove he has what it takes to be a true hero. His test comes when Dr. Robotnik returns, this time with a new partner, Knuckles, in search for an emerald that has the power to destroy civilizations. Sonic teams up with his own sidekick, Tails, and together they embark on a globe-trotting journey to find the emerald before it falls into the wrong hands.","Action, Adventure, Family, Comedy",/6DrHO1jr3qVrViUO6s6kFiAGM7.jpg
210577,Gone Girl,2014-10-01,"With his wife's disappearance having become the focus of an intense media circus, a man sees the spotlight turned on him when it's suspected that he may not be innocent.","Mystery, Thriller, Drama",/ts996lKsxvjkO2yiYG0ht4qAicO.jpg
156022,The Equalizer,2014-09-24,"McCall believes he has put his mysterious past behind him and dedicated himself to beginning a new, quiet life. But when he meets Teri, a young girl under the control of ultra-violent Russian gangsters, he can’t stand idly by – he has to help her. Armed with hidden skills that allow him to serve vengeance against anyone who would brutalize the helpless, McCall comes out of his self-imposed retirement and finds his desire for justice reawakened. If someone has a problem, if the odds are stacked against them, if they have nowhere else to turn, McCall will help. He is The Equalizer.","Thriller, Action, Crime",/9u4yW7yPA0BQ2pv9XwiNzItwvp8.jpg
2062,Ratatouille,2007-06-28,"Remy, a resident of Paris, appreciates good food and has quite a sophisticated palate. He would love to become a chef so he can create and enjoy culinary masterpieces to his heart's delight. The only problem is, Remy is a rat. When he winds up in the sewer beneath one of Paris' finest restaurants, the rodent gourmet finds himself ideally placed to realize his dream.","Animation, Comedy, Family, Fantasy",/t3vaWRPSf6WjDSamIkKDs1iQWna.jpg
425,Ice Age,2002-03-10,"With the impending ice age almost upon them, a mismatched trio of prehistoric critters – Manny the woolly mammoth, Diego the saber-toothed tiger and Sid the giant sloth – find an orphaned infant and decide to return it to its human parents. Along the way, the unlikely allies become friends but, when enemies attack, their quest takes on far nobler aims.","Animation, Comedy, Family, Adventure",/gLhHHZUzeseRXShoDyC4VqLgsNv.jpg
216015,Fifty Shades of Grey,2015-02-11,"When college senior Anastasia Steele steps in for her sick roommate to interview prominent businessman Christian Grey for their campus paper, little does she realize the path her life will take. Christian, as enigmatic as he is rich and powerful, finds himself strangely drawn to Ana, and she to him. Though sexually inexperienced, Ana plunges headlong into an affair -- and learns that Christian's true sexual proclivities push the boundaries of pain and pleasure.","Drama, Romance, Thriller",/63kGofUkt1Mx0SIL4XI4Z5AoSgt.jpg
141052,Justice League,2017-11-15,"Fuelled by his restored faith in humanity and inspired by Superman's selfless act, Bruce Wayne and Diana Prince assemble a team of metahumans consisting of Barry Allen, Arthur Curry and Victor Stone to face the catastrophic threat of Steppenwolf and the Parademons who are on the hunt for three Mother Boxes on Earth.","Action, Adventure, Science Fiction",/eifGNCSDuxJeS1loAXil5bIGgvC.jpg
653346,Kingdom of the Planet of the Apes,2024-05-08,"Several generations following Caesar's reign, apes – now the dominant species – live harmoniously while humans have been reduced to living in the shadows. As a new tyrannical ape leader builds his empire, one young ape undertakes a harrowing journey that will cause him to question all he's known about the past and to make choices that will define a future for apes and humans alike.","Science Fiction, Adventure, Action, Drama, Thriller",/gKkl37BQuKTanygYQG1pyYgLVgf.jpg
76341,Mad Max: Fury Road,2015-05-13,"An apocalyptic story set in the furthest reaches of our planet, in a stark desert landscape where humanity is broken, and most everyone is crazed fighting for the necessities of life. Within this world exist two rebels on the run who just might be able to restore order.","Action, Adventure, Science Fiction",/hA2ple9q4qnwxp3hKVNhroipsir.jpg
290098,The Handmaiden,2016-06-01,"1930s Korea, in the period of Japanese occupation, a new girl, Sookee, is hired as a handmaiden to a Japanese heiress, Hideko, who lives a secluded life on a large countryside estate with her domineering Uncle Kouzuki. But the maid has a secret. She is a pickpocket recruited by a swindler posing as a Japanese Count to help him seduce the Lady to elope with him, rob her of her fortune, and lock her up in a madhouse. The plan seems to proceed according to plan until Sookee and Hideko discover some unexpected emotions.","Thriller, Drama, Romance",/dLlH4aNHdnmf62umnInL8xPlPzw.jpg
1152534,Purgatory Jack,2023-08-20,"Purgatory Jack is a neo-noir mystery thriller set in the afterlife, a dangerous landscape that’s run by a bloodthirsty, limb-collecting gang and populated with outlaws and outcasts. The latest case for musician turned grizzled private detective, Jack Marlin, is helping new arrival Viv Vacious, a punk pop star who overdosed, stay safe as she races against time to find her mother who committed suicide twenty years earlier. While navigating the treacherous terrain of hells waiting room, these two musicians from clashing eras unlock a murderous conspiracy and discover why blood is more than a drug in Purgatory.","Thriller, Drama, Fantasy, Mystery",/wwGC2JxgIqT7DJfBOX0sT5QLKtl.jpg
177572,Big Hero 6,2014-10-24,"A special bond develops between plus-sized inflatable robot Baymax, and prodigy Hiro Hamada, who team up with a group of friends to form a band of high-tech heroes.","Adventure, Family, Animation, Action, Comedy",/2mxS4wUimwlLmI1xp6QW6NSU361.jpg
585,"Monsters, Inc.",2001-11-01,"Lovable Sulley and his wisecracking sidekick Mike Wazowski are the top scare team at Monsters, Inc., the scream-processing factory in Monstropolis. When a little girl named Boo wanders into their world, it's the monsters who are scared silly, and it's up to Sulley and Mike to keep her out of sight and get her back home.","Animation, Comedy, Family",/qjlbN6aK1qgeg3SspFVovT2D1Me.jpg
537915,After,2019-04-11,"Tessa Young is a dedicated student, dutiful daughter and loyal girlfriend to her high school sweetheart. Entering her first semester of college, Tessa's guarded world opens up when she meets Hardin Scott, a mysterious and brooding rebel who makes her question all she thought she knew about herself -- and what she wants out of life.","Romance, Drama",/u3B2YKUjWABcxXZ6Nm9h10hLUbh.jpg
1010335,Shufu to Sei-seikatsu,1984-11-23,A woman marries the fiancé of her late sister but begins to have doubts when he starts to get overly friendly with a former classmate.,Drama,/7Pk6FsCrWTJYDiaQjnQipoP0rg1.jpg
109445,Frozen,2013-11-20,"Young princess Anna of Arendelle dreams about finding true love at her sister Elsa’s coronation. Fate takes her on a dangerous journey in an attempt to end the eternal winter that has fallen over the kingdom. She's accompanied by ice delivery man Kristoff, his reindeer Sven, and snowman Olaf. On an adventure where she will find out what friendship, courage, family, and true love really means.","Animation, Family, Adventure, Fantasy",/m4uhSpErBKprhsclr0zynTYdupb.jpg
1188104,The X-Treme Riders,2023-11-09,"A fast-paced action drama about siblings desperately needing money for their mother's treatment. Then the brother, who is the stunt performer, inevitably needs to be involved with.","Action, Crime",/r6vVnsWyESNpiamrfBvnxXYcWlZ.jpg
940551,Migration,2023-12-06,"After a migrating duck family alights on their pond with thrilling tales of far-flung places, the Mallard family embarks on a family road trip, from New England, to New York City, to tropical Jamaica.","Animation, Adventure, Comedy, Family",/dpXxBDi0ut5svjh5fbAqLoaJSq8.jpg
744746,Caveat,2021-10-20,A lone drifter suffering from partial memory loss accepts a job to look after a psychologically troubled woman in an abandoned house on an isolated island.,"Horror, Mystery, Thriller",/nbug05AceVU8PMXIONDFxMRtq54.jpg
637649,Wrath of Man,2021-04-22,"A cold and mysterious new security guard for a Los Angeles cash truck company surprises his co-workers when he unleashes precision skills during a heist. The crew is left wondering who he is and where he came from. Soon, the marksman's ultimate motive becomes clear as he takes dramatic and irrevocable steps to settle a score.","Action, Crime, Thriller",/M7SUK85sKjaStg4TKhlAVyGlz3.jpg
313369,La La Land,2016-12-01,"Mia, an aspiring actress, serves lattes to movie stars in between auditions and Sebastian, a jazz musician, scrapes by playing cocktail party gigs in dingy bars, but as success mounts they are faced with decisions that begin to fray the fragile fabric of their love affair, and the dreams they worked so hard to maintain in each other threaten to rip them apart.","Comedy, Drama, Romance, Music",/uDO8zWDhfWwoFdKS4fzkUJt0Rf0.jpg
218,The Terminator,1984-10-26,"In the post-apocalyptic future, reigning tyrannical supercomputers teleport a cyborg assassin known as the ""Terminator"" back to 1984 to kill Sarah Connor, whose unborn son is destined to lead insurgents against 21st century mechanical hegemony. Meanwhile, the human-resistance movement dispatches a lone warrior to safeguard Sarah. Can he stop the virtually indestructible killing machine?","Action, Thriller, Science Fiction",/hzXSE66v6KthZ8nPoLZmsi2G05j.jpg
38757,Tangled,2010-11-24,"Feisty teenager Rapunzel, who has long and magical hair, wants to go and see sky lanterns on her eighteenth birthday, but she's bound to a tower by her overprotective mother. She strikes a deal with Flynn Rider, a charming wanted thief, and the duo set off on an action-packed escapade.","Animation, Family, Adventure",/ym7Kst6a4uodryxqbGOxmewF235.jpg
1241752,Rita,2024-03-22,"Rita, who finds herself alone when husband Ariel works abroad. They both find solace and sexual satisfaction in other people. When Ariel comes back, they both act like nothing happened. But will this keep their marriage from falling apart?",Drama,/pXENxAzOBrTSDJGxDcUnlNTNmWr.jpg
228150,Fury,2014-10-15,"In the last months of World War II, as the Allies make their final push in the European theatre, a battle-hardened U.S. Army sergeant named 'Wardaddy' commands a Sherman tank called 'Fury' and its five-man crew on a deadly mission behind enemy lines. Outnumbered and outgunned, Wardaddy and his men face overwhelming odds in their heroic attempts to strike at the heart of Nazi Germany.","War, Drama, Action",/pfte7wdMobMF4CVHuOxyu6oqeeA.jpg
13,Forrest Gump,1994-06-23,"A man with a low IQ has accomplished great things in his life and been present during significant historic events—in each case, far exceeding what anyone imagined he could do. But despite all he has achieved, his one true love eludes him.","Comedy, Drama, Romance",/arw2vcBveWOVZr6pxd9XTd1TdQa.jpg
41264,Africa Addio,1966-02-11,"A chronicle of the violence that occurred in much of the African continent throughout the 1960s. As many African countries were transitioning from colonial rule to other forms of government, violent political upheavals were frequent. Revolutions in Zanzibar and Kenya in which thousands were killed are shown, the violence not only political; there is also extensive footage of hunters and poachers slaughtering different types of wild animals.","Documentary, Horror",/fPLzCid2gk7eOCrYlXIBU24bTpO.jpg
717196,Niko: Beyond the Northern Lights,2024-10-07,"Niko the reindeer joins his father in Santa's Flying Forces, but when Santa's sleigh is stolen by an acquaintance, Niko must find it in time for Christmas.","Animation, Family, Fantasy",/qqt2atvzPJJBvtAAHtwXKO11loQ.jpg
972533,Last Breath,2025-02-27,Seasoned deep-sea divers battle the raging elements to rescue their crewmate trapped hundreds of feet below the ocean's surface.,"Thriller, Drama",/w04Xg5Bnqj7ECdCxTsHgqK6AtJW.jpg
675,Harry Potter and the Order of the Phoenix,2007-07-08,"Returning for his fifth year of study at Hogwarts, Harry is stunned to find that his warnings about the return of Lord Voldemort have been ignored. Left with no choice, Harry takes matters into his own hands, training a small group of students to defend themselves against the dark arts.","Adventure, Fantasy",/5aOyriWkPec0zUDxmHFP9qMmBaj.jpg
667538,Transformers: Rise of the Beasts,2023-06-06,"When a new threat capable of destroying the entire planet emerges, Optimus Prime and the Autobots must team up with a powerful faction known as the Maximals. With the fate of humanity hanging in the balance, humans Noah and Elena will do whatever it takes to help the Transformers as they engage in the ultimate battle to save Earth.","Science Fiction, Adventure, Action",/gPbM0MK8CP8A174rmUwGsADNYKD.jpg
1050035,Monster,2023-06-02,"When a young boy begins behaving strangely, shocking truths emerge as the story unfolds through the eyes of his single mother, a teacher who is believed to be responsible, and the child himself.","Mystery, Thriller, Drama",/kvUJUyUGOhEoiWWNH04IXoExPE2.jpg
1355126,Pabrik Gula,2025-03-31,"A group of young men and women who work as seasonal workers in a sugar factory face terror from the kingdom of demons where the factory is located. They must find out the cause of the demons' anger, before the terror ends their lives.","Horror, Thriller",/nwmR5EL5m8tcPBud6OwUyt8p5z1.jpg
449443,Den of Thieves,2018-01-18,A gritty crime saga which follows the lives of an elite unit of the LA County Sheriff's Dept. and the state's most successful bank robbery crew as the outlaws plan a seemingly impossible heist on the Federal Reserve Bank.,"Action, Crime, Thriller",/dAP5NpkrMMczir5dUPjRR6ywqgz.jpg
762441,A Quiet Place: Day One,2024-06-26,"As New York City is invaded by alien creatures who hunt by sound, a woman named Sam fights to survive with her cat.","Horror, Science Fiction, Thriller",/hU42CRk14JuPEdqZG3AWmagiPAP.jpg
1103621,How to Make Millions Before Grandma Dies,2024-04-04,"M, a university dropout low on money and luck, volunteers to take care of his terminally ill grandmother, in the hope of pocketing an inheritance.",Drama,/9Xa0Grd2jq2lM2gqcoTB4F9TjMd.jpg
110415,Snowpiercer,2013-08-01,"In a future where a failed global-warming experiment kills off most life on the planet, a class system evolves aboard the Snowpiercer; a train that travels around the globe via a perpetual-motion engine.","Action, Science Fiction, Drama",/nzccOvhrLGI0nvAknCEAk8bchD9.jpg
170,28 Days Later,2002-10-31,"Twenty-eight days after a killer virus was accidentally unleashed from a British research facility, a small group of London survivors are caught in a desperate struggle to protect themselves from the infected. Carried by animals and humans, the virus turns those it infects into homicidal maniacs -- and it's absolutely impossible to contain.","Horror, Thriller, Science Fiction",/sQckQRt17VaWbo39GIu0TMOiszq.jpg
12,Finding Nemo,2003-05-30,"Nemo, an adventurous young clownfish, is unexpectedly taken from his Great Barrier Reef home to a dentist's office aquarium. It's up to his worrisome father Marlin and a friendly but forgetful fish Dory to bring Nemo home -- meeting vegetarian sharks, surfer dude turtles, hypnotic jellyfish, hungry seagulls, and more along the way.","Animation, Family",/eHuGQ10FUzK1mdOY69wF5pGgEf5.jpg
4348,Pride & Prejudice,2005-09-16,"A story of love and life among the landed English gentry during the Georgian era. Mr. Bennet is a gentleman living in Hertfordshire with his overbearing wife and five daughters, but if he dies their house will be inherited by a distant cousin whom they have never met, so the family's future happiness and security is dependent on the daughters making good marriages.","Drama, Romance",/sGjIvtVvTlWnia2zfJfHz81pZ9Q.jpg
284054,Black Panther,2018-02-13,"King T'Challa returns home to the reclusive, technologically advanced African nation of Wakanda to serve as his country's new leader. However, T'Challa soon finds that he is challenged for the throne by factions within his own country as well as without. Using powers reserved to Wakandan kings, T'Challa assumes the Black Panther mantle to join with ex-girlfriend Nakia, the queen-mother, his princess-kid sister, members of the Dora Milaje (the Wakandan 'special forces') and an American secret agent, to prevent Wakanda from being dragged into a world war.","Action, Adventure, Science Fiction",/uxzzxijgPIY7slzFvMotPv8wjKA.jpg
1422211,The Pursuit of Lust,2025-01-23,"Sensual Mongolian actress E.Khandmaa stars in this romantic drama, which highlights a housewife’s longing for pleasure her passionless husband fails to provide. That is until her spouse’s business client eventually gives in to her desires.","Romance, Drama",/affsHDxbgTpCHQbC5GVyZCbuukO.jpg
475557,Joker,2019-10-01,"During the 1980s, a failed stand-up comedian is driven insane and turns to a life of crime and chaos in Gotham City while becoming an infamous psychopathic crime figure.","Crime, Thriller, Drama",/udDclJoHjfjb8Ekgsd4FDteOkCU.jpg
1244361,Operation Undead,2024-07-20,"Inexperienced Thai soldiers battle a growing undead menace in this gruesome survival horror. A Japanese military experiment that turns men into monsters escapes containment, it’s up to these troops to save their nation from annihilation.","Horror, Action, Thriller",/rs10lMBnJFnJX1Y7MYpyB8JiNAF.jpg
929204,Wallace & Gromit: Vengeance Most Fowl,2024-12-18,"Gromit’s concern that Wallace is becoming too dependent on his inventions proves justified, when Wallace invents a “smart” gnome that seems to develop a mind of its own. When it emerges that a vengeful figure from the past might be masterminding things, it falls to Gromit to battle sinister forces and save his master… or Wallace may never be able to invent again!","Family, Comedy, Adventure, Animation",/6BxK38ehxuX2dJmZIMpJcVNbYks.jpg
670,Oldboy,2003-11-21,"With no clue how he came to be imprisoned, drugged and tortured for 15 years, a desperate man seeks revenge on his captors.","Drama, Thriller, Mystery, Action",/pWDtjs568ZfOTMbURQBYuT4Qxka.jpg
121,The Lord of the Rings: The Two Towers,2002-12-18,"Frodo Baggins and the other members of the Fellowship continue on their sacred quest to destroy the One Ring--but on separate paths. Their destinies lie at two towers--Orthanc Tower in Isengard, where the corrupt wizard Saruman awaits, and Sauron's fortress at Barad-dur, deep within the dark lands of Mordor. Frodo and Sam are trekking to Mordor to destroy the One Ring of Power while Gimli, Legolas and Aragorn search for the orc-captured Merry and Pippin. All along, nefarious wizard Saruman awaits the Fellowship members at the Orthanc Tower in Isengard.","Adventure, Fantasy, Action",/5VTN0pR8gcqV3EPUHHfMGnJYN9L.jpg
872585,Oppenheimer,2023-07-19,The story of J. Robert Oppenheimer's role in the development of the atomic bomb during World War II.,"Drama, History",/8Gxv8gSFCU0XGDykEGv7zR1n2ua.jpg
11,Star Wars,1977-05-25,Princess Leia is captured and held hostage by the evil Imperial forces in their effort to take over the galactic Empire. Venturesome Luke Skywalker and dashing captain Han Solo team together with the loveable robot duo R2-D2 and C-3PO to rescue the beautiful princess and restore peace and justice in the Empire.,"Adventure, Action, Science Fiction",/6FfCtAuVAW8XJjZ7eWeLibRLWTw.jpg
37799,The Social Network,2010-10-01,"In 2003, Harvard undergrad and computer programmer Mark Zuckerberg begins work on a new concept that eventually turns into the global social network known as Facebook. Six years later, Mark is one of the youngest billionaires ever, but his unprecedented success leads to both personal and legal complications when he ends up on the receiving end of two lawsuits, one involving his former friend.",Drama,/n0ybibhJtQ5icDqTp8eRytcIHJx.jpg
1003596,Avengers: Doomsday,2026-04-29,"The Avengers, Wakandans, Fantastic Four, Thunderbolts, and X-Men all fight against Doctor Doom. Plot TBA.",Science Fiction,/6eB2oh1SplddsZYCdayrIdrIGLd.jpg
566525,Shang-Chi and the Legend of the Ten Rings,2021-09-01,Shang-Chi must confront the past he thought he left behind when he is drawn into the web of the mysterious Ten Rings organization.,"Action, Adventure, Fantasy, Science Fiction",/d08HqqeBQSwN8i8MEvpsZ8Cb438.jpg
1265623,Banger,2025-04-01,"When cops recruit a has-been DJ to bust a quirky criminal gang with ties to his rival, he spots a chance to mix his way back to the top with a banger.","Comedy, Music",/2QAgOQWcdQLnbki5V2Sjn1tcnHS.jpg
530385,Midsommar,2019-07-03,"Several friends travel to Sweden to study as anthropologists a summer festival that is held every ninety years in the remote hometown of one of them. What begins as a dream vacation in a place where the sun never sets, gradually turns into a dark nightmare as the mysterious inhabitants invite them to participate in their disturbing festive activities.","Horror, Drama, Mystery",/7LEI8ulZzO5gy9Ww2NVCrKmHeDZ.jpg
1232449,Young Hearts,2024-10-26,"14-year-old Elias increasingly feels like an outsider in his village. When he meets his new neighbour of the same age, Alexander, Elias is confronted with his burgeoning sexuality.","Drama, Romance",/iGCtYxfuvXfy0BD5m6p7vKuPOxS.jpg
957452,The Crow,2024-08-21,"Soulmates Eric and Shelly are brutally murdered when the demons of her dark past catch up with them. Given the chance to save his true love by sacrificing himself, Eric sets out to seek merciless revenge on their killers, traversing the worlds of the living and the dead to put the wrong things right.","Action, Fantasy, Horror",/g8TbOXrNMuqq7AaKqdvqS2oG4ob.jpg
244786,Whiplash,2014-10-10,"Under the direction of a ruthless instructor, a talented young drummer begins to pursue perfection at any cost, even his humanity.","Drama, Music",/7fn624j5lj3xTme2SgiLCeuedmO.jpg
1187294,¿Quién es quién?,2024-12-05,"The Fuentes are not the best family in the world. But what family is it? Work, school and routine have plunged them into a spiral of disconnection that seems impossible to stop. However, everything changes when the youngest of the group, Valentina, makes a wish for her ninth birthday. The next day, all the members of the family wake up with their bodies swapped: The father is in his wife's body, the girl is trapped in the grandmother's body, the teenage twins are not themselves... Chaos takes over. the family and, desperate, they ask themselves: Who is who? While the family faces crazy situations and hilarious circumstances, the Fuentes must learn to get under each other's skin and trust each other to turn the situation around. Will they be able to return to their original bodies and get their lives back?","Comedy, Family",/o4T0QAgm9bBWaU7kHWGD3o5b4M2.jpg
4935,Howl's Moving Castle,2004-09-09,"Sophie, a young milliner, is turned into an elderly woman by a witch who enters her shop and curses her. She encounters a wizard named Howl and gets caught up in his resistance to fighting for the king.","Fantasy, Animation, Adventure",/23hUJh7JdO23SpgUB5oiFDQk2wX.jpg
552524,Lilo & Stitch,2025-05-21,The wildly funny and touching story of a lonely Hawaiian girl and the fugitive alien who helps to mend her broken family.,"Family, Comedy, Science Fiction",/3bN675X0K2E5QiAZVChzB5wq90B.jpg
2405,Joseph,1995-04-10,"Joseph, favored son of Jacob and great-grandson of Abraham, is sold into slavery by his jealous brothers. Rising to become prime minister of Egypt. Joseph governed the country during a seven year famine, during which his brothers visit Egypt seeking grain, only to encounter their brother, presumed long dead.","Adventure, Drama, TV Movie",/lBscKQzEJY1XF2ReZT2vIGrMQ1k.jpg
414906,The Batman,2022-03-01,"In his second year of fighting crime, Batman uncovers corruption in Gotham City that connects to his own family while facing a serial killer known as the Riddler.","Crime, Mystery, Thriller",/74xTEgt7R36Fpooo50r9T25onhq.jpg
