id,title,release_date,overview,genres,poster_path
411088,The Invisible Guest,2017-01-06,"Barcelona, Spain. Adrián Doria, a young and successful businessman accused of murder, meets one night with Virginia Goodman, an expert interrogation lawyer, in order to devise a defense strategy.","Drama, Mystery, Thriller",/fptnZJbLzKUHeNlYrAynbyoL5YJ.jpg
318846,The Big Short,2015-12-11,The men who made millions from a global economic meltdown.,"Comedy, Drama",/isuQWbJPbjybBEWdcCaBUPmU0XO.jpg
185652,Female Teacher in Rope Hell,1981-08-27,"A female teacher spots one of her students being molested by a vagrant. But her rescue attempt fails as the vagrant drags the teacher into an empty classroom and sexually assaults her. The student finds a school employee, a piano tuner, to try and help but all they can offer is some comfort. Later the piano tuner invites the teacher to his house. He wants her to be his obedient loving bride and has built a nice caged apartment in his basement all for her. He subjects her to an endless series of sexual humiliations to persuade her to say yes.","Drama, Horror",/cqrUkz4AtoPKlGovyz7gZL2aWhU.jpg
383498,Deadpool 2,2018-05-15,Wisecracking mercenary Deadpool battles the evil and powerful Cable and other bad guys to save a boy's life.,"Action, Comedy, Adventure",/to0spRl1CMDvyUbOnbb4fTk3VAd.jpg
400535,Sicario: Day of the Soldado,2018-06-27,Agent Matt Graver teams up with operative Alejandro Gillick to prevent Mexican drug cartels from smuggling terrorists across the United States border.,"Action, Crime, Thriller",/msqWSQkU403cQKjQHnWLnugv7EY.jpg
399579,Alita: Battle Angel,2019-01-31,"When Alita awakens with no memory of who she is in a future world she does not recognize, she is taken in by Ido, a compassionate doctor who realizes that somewhere in this abandoned cyborg shell is the heart and soul of a young woman with an extraordinary past.","Action, Science Fiction, Adventure",/xRWht48C2V8XNfzvPehyClOvDni.jpg
21208,Orphan,2009-07-24,"After losing their baby, a married couple adopt 9-year old Esther, who may not be as innocent as she seems.","Horror, Thriller",/lCGpOgoTOGLtZnBiGY9HRg5Xnjd.jpg
46705,Blue Valentine,2010-12-26,"Dean and Cindy live a quiet life in a modest neighborhood. They appear to have the world at their feet at the outset of the relationship. However, his lack of ambition and her retreat into self-absorption cause potentially irreversible cracks in their marriage.","Drama, Romance",/dc8BdKnDY5Iy28KzUGtHIXuqqFK.jpg
9693,Children of Men,2006-09-22,"In 2027, in a chaotic world in which humans can no longer procreate, a former activist agrees to help transport a miraculously pregnant woman to a sanctuary at sea, where her child's birth may help scientists save the future of humankind.","Drama, Action, Thriller, Science Fiction",/8Xgvmx7WWc7Z9Ws9RAYk7uya2kh.jpg
4909,The Day of the Jackal,1973-05-16,"An international assassin known as ‘The Jackal’ is employed by disgruntled French generals to kill President Charles de Gaulle, with a dedicated gendarme on the assassin’s trail.","Action, Thriller",/vThgcb3JOj99yETg8WChuci4LV2.jpg
533444,Waves,2019-11-15,A controlling father’s attempts to ensure that his two children succeed in high school backfire after his son experiences a career-ending sports injury. Their familial bonds are eventually placed under severe strain by an unexpected tragedy.,"Romance, Drama",/3xbjL0z8iH8e8L3USyeKGQrBfuZ.jpg
753342,Napoleon,2023-11-22,"An epic that details the checkered rise and fall of French Emperor Napoleon Bonaparte and his relentless journey to power through the prism of his addictive, volatile relationship with his wife, Josephine.","History, War, Romance",/ytFOXyghxLzAM4KZyazDdEkM66q.jpg
437342,The First Omen,2024-04-03,"When a young American woman is sent to Rome to begin a life of service to the church, she encounters a darkness that causes her to question her own faith and uncovers a terrifying conspiracy that hopes to bring about the birth of evil incarnate.",Horror,/tnsDyNNkOxYUyjD8CNJoAla6YvY.jpg
772,Home Alone 2: Lost in New York,1992-11-15,"Instead of flying to Florida with his folks, Kevin ends up alone in New York, where he gets a hotel room with his dad's credit card—despite problems from a clerk and meddling bellboy. But when Kevin runs into his old nemeses, the Wet Bandits, he's determined to foil their plans to rob a toy store on Christmas Eve.","Comedy, Family, Adventure",/uuitWHpJwxD1wruFl2nZHIb4UGN.jpg
550988,Free Guy,2021-08-11,"A bank teller discovers he is actually a background player in an open-world video game, and decides to become the hero of his own story. Now, in a world where there are no limits, he is determined to be the guy who saves his world his way before it's too late.","Comedy, Adventure, Science Fiction",/6PFJrMvoQwBxQITLYHj09VeJ37q.jpg
615173,The Witch: Part 2. The Other One,2022-06-15,"A girl wakes up in a huge secret laboratory, then accidentally meets another girl who is trying to protect her house from a gang. The mystery girl overthrows the gang with her unexpected powers, and laboratory staff set out to find her.","Action, Mystery, Thriller, Science Fiction",/9YTuscJXmr9Iua62amCgGSU8PDW.jpg
976576,Emmanuelle,2024-09-25,"Emmanuelle, a quality controller for a luxury hotel brand, arrives in Hong Kong to evaluate a hotel run by Margot, having been tasked with finding a good reason to sack her. Searching for a lost pleasure, she has numeral sensual experiences inside the hotel, and crosses path with Kei, a mysterious client who she becomes infatuated with.","Romance, Drama",/s9gmKus9YPTDzdMKZQJYPh0VoGk.jpg
206487,Predestination,2014-08-28,"Predestination chronicles the life of a Temporal Agent sent on an intricate series of time-travel journeys designed to prevent future killers from committing their crimes. Now, on his final assignment, the Agent must stop the one criminal that has eluded him throughout time and prevent a devastating attack in which thousands of lives will be lost.","Science Fiction, Thriller",/38Xr1JnV1ZcLQ55zmdSp6n475cZ.jpg
646385,Scream,2022-01-12,"Twenty-five years after a streak of brutal murders shocked the quiet town of Woodsboro, a new killer has donned the Ghostface mask and begins targeting a group of teenagers to resurrect secrets from the town’s deadly past.","Horror, Mystery, Thriller, Crime",/1m3W6cpgwuIyjtg5nSnPx7yFkXW.jpg
395834,Wind River,2017-08-03,An FBI agent teams with the town's veteran game tracker to investigate a murder that occurred on a Native American reservation.,"Crime, Mystery, Thriller",/pySivdR845Hom4u4T2WNkJxe6Ad.jpg
98566,Teenage Mutant Ninja Turtles,2014-08-07,"When a kingpin threatens New York City, a group of mutated turtle warriors must emerge from the shadows to protect their home.","Science Fiction, Action, Adventure, Comedy",/azL2ThbJMIkts3ZMt3j1YgBUeDB.jpg
317442,The Last: Naruto the Movie,2014-12-06,"Two years after the events of the Fourth Great Ninja War, the moon that Hagoromo Otsutsuki created long ago to seal away the Gedo Statue begins to descend towards the world, threatening to become a meteor that would destroy everything on impact. Amidst this crisis, a direct descendant of Kaguya Otsutsuki named Toneri Otsutsuki attempts to kidnap Hinata Hyuga but ends up abducting her younger sister Hanabi. Naruto and his allies now mount a rescue mission before finding themselves embroiled in a final battle to decide the fate of everything.","Action, Romance, Animation",/bAQ8O5Uw6FedtlCbJTutenzPVKd.jpg
10591,The Girl Next Door,2004-04-09,"Exceptionally ambitious high schooler Matthew has aspirations for a career in politics when he falls in love with his gorgeous 19-year-old neighbor, Danielle. But Matthew's bright future is jeopardized when he finds Danielle was once a porn star. As Danielle's past catches up with her, Matthew's love for her forces him to re-evaluate his goals.","Comedy, Romance",/5mVyFHSY2rSsNgD4NfEwV82HigU.jpg
14574,The Boy in the Striped Pyjamas,2008-05-07,"When his family moves from their home in Berlin to a strange new house in Poland, young Bruno befriends Shmuel, a boy who lives on the other side of the fence where everyone seems to be wearing striped pajamas. Unaware of Shmuel's fate as a Jewish prisoner or the role his own Nazi father plays in his imprisonment, Bruno embarks on a dangerous journey inside the camp's walls.","Drama, War, History",/sLwYSEVVV3r047cjrpRAbGgNsfL.jpg
1075794,Leo,2023-11-17,"Jaded 74-year-old lizard Leo has been stuck in the same Florida classroom for decades with his terrarium-mate turtle. When he learns he only has one year left to live, he plans to escape to experience life on the outside but instead gets caught up in the problems of his anxious students — including an impossibly mean substitute teacher.","Animation, Comedy, Family",/pD6sL4vntUOXHmuvJPPZAgvyfd9.jpg
561,Constantine,2005-02-08,"John Constantine has literally been to Hell and back. When he teams up with a policewoman to solve the mysterious suicide of her twin sister, their investigation takes them through the world of demons and angels that exists beneath the landscape of contemporary Los Angeles.","Fantasy, Action, Horror",/vPYgvd2MwHlxTamAOjwVQp4qs1W.jpg
59068,Sister Emanuelle,1977-08-10,"Sister Emanuelle and Sister Nanà go to meet Mr. Cazzabriga, who has a problem: his wild-child daughter, Monica, who he wants to send to a Catholic school to remove her from temptations around the house.","Drama, Crime, Horror",/eRmBJGmljHY9o7OHpcmPfdMKqQg.jpg
427641,Rampage,2018-04-11,"Primatologist Davis Okoye shares an unshakable bond with George, the extraordinarily intelligent, silverback gorilla who has been in his care since birth.  But a rogue genetic experiment gone awry mutates this gentle ape into a raging creature of enormous size.  To make matters worse, it’s soon discovered there are other similarly altered animals.  As these newly created alpha predators tear across North America, destroying everything in their path, Okoye teams with a discredited genetic engineer to secure an antidote, fighting his way through an ever-changing battlefield, not only to halt a global catastrophe but to save the fearsome creature that was once his friend.","Action, Adventure, Science Fiction",/MGADip4thVSErP34FAAfzFBTZ5.jpg
1933,The Others,2001-08-02,"Grace is a religious woman who lives in an old house kept dark because her two children, Anne and Nicholas, have a rare sensitivity to light. When the family begins to suspect the house is haunted, Grace fights to protect her children at any cost in the face of strange events and disturbing visions.","Horror, Mystery, Thriller",/p8g1vlTvpM6nr2hMMiZ1fUlKF0D.jpg
93456,Despicable Me 2,2013-06-26,Gru is recruited by the Anti-Villain League to help deal with a powerful new super criminal.,"Animation, Comedy, Family",/oyMPJJZoOpLHgJoFPUOn6DgkbWJ.jpg
776503,CODA,2021-08-13,"As a CODA (Child of Deaf Adults), Ruby is the only hearing person in her deaf family. When the family's fishing business is threatened, Ruby finds herself torn between pursuing her love of music and her fear of abandoning her parents.","Drama, Music, Romance",/BzVjmm8l23rPsijLiNLUzuQtyd.jpg
75656,Now You See Me,2013-05-29,An FBI agent and an Interpol detective track a team of illusionists who pull off bank heists during their performances and reward their audiences with the money.,"Thriller, Crime",/tWsNYbrqy1p1w6K9zRk0mSchztT.jpg
1244881,Alone In The Night,2024-09-20,"A group of labour lawyers hide in a house when the coup d'état of 23F takes place in Spain. Unsure of what to do, they debate between fleeing the country, staying in hiding or trying to do something to defend Spain's young democracy.","Action, Comedy, Drama",/fIR4praOsKJaRA3qUC2mbzDojan.jpg
609681,The Marvels,2023-11-08,"Carol Danvers, aka Captain Marvel, has reclaimed her identity from the tyrannical Kree and taken revenge on the Supreme Intelligence. But unintended consequences see Carol shouldering the burden of a destabilized universe. When her duties send her to an anomalous wormhole linked to a Kree revolutionary, her powers become entangled with that of Jersey City super-fan Kamala Khan, aka Ms. Marvel, and Carol’s estranged niece, now S.A.B.E.R. astronaut Captain Monica Rambeau. Together, this unlikely trio must team up and learn to work in concert to save the universe.","Science Fiction, Adventure, Action",/9GBhzXMFjgcZ3FdR9w3bUMMTps5.jpg
11969,Tombstone,1993-12-25,"Legendary marshal Wyatt Earp, now a weary gunfighter, joins his brothers Morgan and Virgil to pursue their collective fortune in the thriving mining town of Tombstone. But Earp is forced to don a badge again and get help from his notorious pal Doc Holliday when a gang of renegade brigands and rustlers begins terrorizing the town.","Western, Action",/f6Lb4bpUW2AJW42Hpnix2533RKU.jpg
4982,American Gangster,2007-11-02,"Following the death of his employer and mentor, Bumpy Johnson, Frank Lucas establishes himself as the number one importer of heroin in the Harlem district of Manhattan. He does so by buying heroin directly from the source in South East Asia and he comes up with a unique way of importing the drugs into the United States. Partly based on a true story.","Drama, Crime",/8sV6nWuKczuXRt0C6EWoXqJAj6G.jpg
254128,San Andreas,2015-05-27,"In the aftermath of a massive earthquake in California, a rescue-chopper pilot makes a dangerous journey across the state in order to rescue his estranged daughter.","Action, Drama, Thriller",/2Gfjn962aaFSD6eST6QU3oLDZTo.jpg
7512,Idiocracy,2006-09-01,"To test its top-secret Human Hibernation Project, the Pentagon picks the most average Americans it can find - an Army private and a prostitute - and sends them to the year 2505 after a series of freak events. But when they arrive, they find a civilization so dumbed-down that they're the smartest people around.","Comedy, Science Fiction, Adventure",/q7sn0A3BkBxvzdwVFOGmJGE2vF8.jpg
967,Spartacus,1960-10-13,"The rebellious Thracian Spartacus, born and raised a slave, is sold to Gladiator trainer Batiatus. After weeks of being trained to kill for the arena, Spartacus turns on his owners and leads the other slaves in rebellion. As the rebels move from town to town, their numbers swell as escaped slaves join their ranks. Under the leadership of Spartacus, they make their way to southern Italy, where they will cross the sea and return to their homes.","History, War, Drama, Adventure",/xLPpQlFWE12cbqNJQ5Vf4eJU8ij.jpg
293670,The Wailing,2016-05-12,A stranger arrives in a little village and soon after a mysterious sickness starts spreading. A policeman is drawn into the incident and is forced to solve the mystery in order to save his daughter.,"Horror, Mystery",/aXlL7yYwpXInhltamtzKQFBG08G.jpg
774825,The Ice Age Adventures of Buck Wild,2022-01-28,The fearless one-eyed weasel Buck teams up with mischievous possum brothers Crash & Eddie as they head off on a new adventure into Buck's home: The Dinosaur World.,"Animation, Comedy, Family, Adventure",/zzXFM4FKDG7l1ufrAkwQYv2xvnh.jpg
8095,Cleopatra,1963-06-12,"Determined to hold on to the throne, Cleopatra seduces the Roman emperor Julius Caesar. When Caesar is murdered, she redirects her attentions to his general, Marc Antony, who vows to take power—but Caesar’s successor has other plans.","Drama, History, Romance",/bj7rUGUewofA9cpHt1h36gvDFfy.jpg
423204,Angel Has Fallen,2019-08-21,"After a treacherous attack, Secret Service agent Mike Banning is charged with attempting to assassinate President Trumbull. Chased by his own colleagues and the FBI, Banning begins a race against the clock to clear his name.","Action, Thriller",/fapXd3v9qTcNBTm39ZC4KUVQDNf.jpg
18240,The Proposal,2009-06-02,"When she learns she's in danger of losing her visa status and being deported, overbearing book editor Margaret Tate forces her put-upon assistant, Andrew Paxton, to marry her.","Comedy, Romance, Drama",/aEqtJDj8MvSDQwzggvcOfFTZMw.jpg
299054,Expend4bles,2023-09-15,"Armed with every weapon they can get their hands on and the skills to use them, The Expendables are the world’s last line of defense and the team that gets called when all other options are off the table. But new team members with new styles and tactics are going to give “new blood” a whole new meaning.","Action, Adventure, Thriller",/iwsMu0ehRPbtaSxqiaUDQB9qMWT.jpg
374720,Dunkirk,2017-07-19,"The story of the miraculous evacuation of Allied soldiers from Belgium, Britain, Canada and France, who were cut off and surrounded by the German army from the beaches and harbour of Dunkirk between May 26th and June 4th 1940 during World War II.","War, Action, Drama",/b4Oe15CGLL61Ped0RAS9JpqdmCt.jpg
1280461,Dirty Ice Cream,2024-05-10,"Villagers are experiencing an extreme heat. Two hot ice cream vendors come to the village to sell ice cream. With electricity out, the women of the subdivision take turns having the vendors satisfy their every needs.",Drama,/qrD5DuwYuzdwcT5MAeopA4vZfIN.jpg
7214,Coach Carter,2005-01-14,"Based on a true story, in which Richmond High School head basketball coach Ken Carter made headlines in 1999 for benching his undefeated team due to poor academic results.","Drama, History",/y3HOTTyM5nLsdUzXFtFCohG28qj.jpg
1208491,Zak & Wowo: The Legend of Lendarys,2024-04-25,"At the heart of an imaginary world populated by fantastical creatures and dangerous monsters, the 13 year-old Zak goes in search of his twin brother Kyle, who has disappeared mysteriously. Equipped with a magical jade stone whose superpowers he doesn't yet know how to control, he is joined by his grandmother NaïNaï and Indiana, a beautiful outlaw who can communicate with the world's fantastical creatures. But he is also flanked by Wowo, formerly a 3 meter-tall furry pachyderm, now turned into a tiny, cute and wacky furball by the magical jade stone.","Animation, Adventure, Fantasy",/tgOq45Aijeup6mqEmOWGzYabaVQ.jpg
8358,Cast Away,2000-12-22,"Chuck Nolan, a top international manager for FedEx, and Kelly, a Ph.D. student, are in love and heading towards marriage. Then Chuck's plane to Malaysia crashes at sea during a terrible storm. He's the only survivor, and finds himself marooned on a desolate island. With no way to escape, Chuck must find ways to survive in his new home.","Adventure, Drama",/7lLJgKnAicAcR5UEuo8xhSMj18w.jpg
601796,Alienoid,2022-07-20,"Gurus in the late Goryeo dynasty try to obtain a fabled, holy sword, and humans in 2022 hunt down an alien prisoner that is locked in a human's body. The two parties cross paths when a time-traveling portal opens up.","Science Fiction, Action, Fantasy, Adventure",/8QVDXDiOGHRcAD4oM6MXjE0osSj.jpg
1078600,Marked Men: Rule + Shaw,2025-01-22,"Shaw Landon has loved Rule Archer from the moment she laid eyes on him. Rule, a fiery-tempered rebel tattoo artist, doesn’t have time for a good girl pre-med student like Shaw — even if she’s the only one who can see the person he truly is. She lives by other people’s rules; he makes his own. But a short skirt, too many birthday cocktails, and spilled secrets lead to a night neither can forget. Now, Shaw and Rule must figure out how a girl like her and a guy like him are supposed to be together without destroying their love…or each other.","Romance, Drama",/gZQU8BtCH2IbMZq6QETiU4HXQSR.jpg
343668,Kingsman: The Golden Circle,2017-09-20,"When an attack on the Kingsman headquarters takes place and a new villain rises, Eggsy and Merlin are forced to work together with the American agency known as the Statesman to save the world.","Action, Adventure, Comedy, Crime, Thriller, Science Fiction",/34xBL6BXNYFqtHO9zhcgoakS4aP.jpg
177677,Mission: Impossible - Rogue Nation,2015-07-23,"Ethan and team take on their most impossible mission yet—eradicating 'The Syndicate', an International and highly-skilled rogue organization committed to destroying the IMF.","Action, Adventure",/sGvcWcI99OTXLzghD7qXw00KaY5.jpg
760104,X,2022-03-17,"In 1979, a group of young filmmakers set out to make an adult film in rural Texas, but when their reclusive, elderly hosts catch them in the act, the cast find themselves fighting for their lives.","Horror, Mystery, Thriller",/lopZSVtXzhFY603E9OqF7O1YKsh.jpg
923667,Twilight of the Warriors: Walled In,2024-04-23,"In 1980s Hong Kong, troubled youth Chan Lok-kwun, a mainland refugee, struggles to survive in the Kowloon Walled City by joining underground fights. Betrayed by crime boss Mr. Big while trying to buy a fake ID, he steals drugs from him and seeks refuge in the Walled City, where he encounters Cyclone, a compassionate yet authoritative crime lord.","Action, Crime, Thriller",/h0tunBO4tMjvKVVG7fXqHgwOr5C.jpg
359724,Ford v Ferrari,2019-11-13,"American car designer Carroll Shelby and the British-born driver Ken Miles work together to battle corporate interference, the laws of physics, and their own personal demons to build a revolutionary race car for Ford Motor Company and take on the dominating race cars of Enzo Ferrari at the 24 Hours of Le Mans in France in 1966.","Drama, Action, History",/dR1Ju50iudrOh3YgfwkAU1g2HZe.jpg
274870,Passengers,2016-12-21,"A spacecraft traveling to a distant colony planet and transporting thousands of people has a malfunction in its sleep chambers. As a result, two passengers are awakened 90 years early.","Drama, Romance, Science Fiction",/oZpdONg32luHu0g8HcysuPgSlIK.jpg
976893,Perfect Days,2023-11-10,"Hirayama is content with his life as a toilet cleaner in Tokyo. Outside of his structured routine, he cherishes music on cassette tapes, books, and taking photos of trees. Through unexpected encounters, he reflects on finding beauty in the world.",Drama,/mjEk5Wwx6TYVqw29zSaUHclMIgp.jpg
9341,The Core,2003-03-28,"Geophysicist Dr. Josh Keyes discovers that an unknown force has caused the earth's inner core to stop rotating. With the planet's magnetic field rapidly deteriorating, our atmosphere literally starts to come apart at the seams with catastrophic consequences. To resolve the crisis, Keyes, along with a team of the world's most gifted scientists, travel into the earth's core. Their mission: detonate a device that will reactivate the core.","Science Fiction, Adventure, Thriller",/iMPR3OFhKNVvJw4eZoRhf9RzfHJ.jpg
459151,The Boss Baby: Family Business,2021-07-01,The Templeton brothers — Tim and his Boss Baby little bro Ted — have become adults and drifted away from each other. But a new boss baby with a cutting-edge approach and a can-do attitude is about to bring them together again … and inspire a new family business.,"Animation, Comedy, Adventure, Family",/kv2Qk9MKFFQo4WQPaYta599HkJP.jpg
242582,Nightcrawler,2014-10-23,"When Lou Bloom, desperate for work, muscles into the world of L.A. crime journalism, he blurs the line between observer and participant to become the star of his own story. Aiding him in his effort is Nina, a TV-news veteran.","Crime, Drama, Thriller",/j9HrX8f7GbZQm1BrBiR40uFQZSb.jpg
50270,Paprika,1991-02-13,"Mimma starts working in Madame Colette’s brothel to help her boyfriend financially. There she is rechristened “Paprika,” and falls in love with her first client, naval officer Franco. Despite this attraction, she begins her climb through the sex trade, residing in Italy’s most illustrious brothels.",Drama,/A2VdIkrwBtfbZphrzxpIvEfetjl.jpg
260346,Taken 3,2014-12-16,"Ex-government operative Bryan Mills finds his life is shattered when he's falsely accused of a murder that hits close to home. As he's pursued by a savvy police inspector, Mills employs his particular set of skills to track the real killer and exact his unique brand of justice.","Thriller, Action",/vzvMXMypMq7ieDofKThsxjHj9hn.jpg
605,The Matrix Revolutions,2003-11-05,The human city of Zion defends itself against the massive invasion of the machines as Neo fights to end the war at another front while also opposing the rogue Agent Smith.,"Adventure, Action, Thriller, Science Fiction",/t1wm4PgOQ8e4z1C6tk1yDNrps4T.jpg
937287,Challengers,2024-04-18,"Tennis player turned coach Tashi has taken her husband, Art, and transformed him into a world-famous Major champion. To jolt him out of his recent losing streak, she signs him up for a ""Challenger"" event — close to the lowest level of pro tournament — where he finds himself standing across the net from his former best friend and Tashi's former boyfriend.","Drama, Romance",/H6vke7zGiuLsz4v4RPeReb9rsv.jpg
4553,The Machinist,2004-09-24,"Trevor, an insomniac lathe operator, experiences unusual occurrences at work and home. A strange man follows him everywhere, but no one else seems to notice him.","Thriller, Drama",/vA6G0sVHPkJh580F7AtwXuQ7AAW.jpg
694943,Pizza Dare 1,2020-04-10,"Seok, who wants to try perverted sex, pesters Hyun-jin every day, but Hyun-jin rejects it saying she only like normal things.  And then one day while delivering chicken, he found So-ra and Hyun-soo, a couple who enjoys delivery exposures.  Frustrated as he is with Hyun-jin, he starts neglecting her and became more and more hooked with the So-ra couple.  To recover their relationship, Hyun-jin goes on a date with Seok. But then a call came for him. The couple invites him for sex.  Will he be having a date with his wife, or will he accept the invitation he may only get once in a lifetime?  What would be his choice?",Romance,/km7xKnZoHUXqiozCGzauunMp9OF.jpg
158852,Tomorrowland,2015-05-19,"Bound by a shared destiny, a bright, optimistic teen bursting with scientific curiosity and a former boy-genius inventor jaded by disillusionment embark on a danger-filled mission to unearth the secrets of an enigmatic place somewhere in time and space that exists in their collective memory as ""Tomorrowland.""","Adventure, Family, Mystery, Science Fiction",/kziYpr5Nfw60P0My8aj1sgCEqed.jpg
